<?xml version="1.0" encoding="UTF-8"?>
<alumnos xmlns:xsi="http://www.w3.org/2001/XMLSchema-instance"
              xsi:noNamespaceSchemaLocation="alumnos.xsd">
    <alumno>
      <nombre>David</nombre>
      <ciclo>DAW</ciclo>
    </alumno>
    <alumno>
      <nombre>Antonio</nombre>
      <ciclo>ASIR</ciclo>
    </alumno>
    <alumno>
      <nombre>Rafa</nombre>
      <ciclo>Cocina</ciclo>
    </alumno>
</alumnos>